{
  "id": "auth-login",
  "kind": "render-contract",
  "version": "1.0.0",
  "page": {
    "id": "auth-login",
    "viewId": "ai-ui.login-form",
    "contentArchetypeId": "login-form",
    "layoutArchetypeId": "auth-shell",
    "routePath": "/sign-in",
    "title": "Welcome back"
  },
  "layout": {
    "id": "auth-shell",
    "regions": [
      "main",
      "aside"
    ],
    "rules": {
      "maxWidth": "layout-container",
      "contentWidth": "layout-container-narrow",
      "alignment": "center",
      "density": "comfortable"
    },
    "intro": {
      "eyebrow": "Secure access",
      "headline": "Welcome back",
      "supportingText": "Sign in to continue into your workspace."
    }
  },
  "head": {
    "title": "Welcome back",
    "tags": [
      {
        "tag": "meta",
        "key": "meta:key:description",
        "props": {
          "name": "description",
          "content": "Sign in to continue into your workspace."
        }
      },
      {
        "tag": "link",
        "key": "link:canonical",
        "props": {
          "rel": "canonical",
          "href": "https://example.com/sign-in"
        }
      }
    ],
    "htmlAttrs": {
      "attrs": {
        "lang": "en"
      },
      "classes": [
        "auth-page"
      ],
      "style": {}
    },
    "bodyAttrs": {
      "attrs": {
        "data-view": "auth-login"
      },
      "classes": [],
      "style": {}
    }
  },
  "regions": {
    "hero": [],
    "main": [
      {
        "component": "card",
        "props": {
          "title": "Welcome back",
          "description": "Use your work email and password to access your workspace.",
          "tone": "subtle"
        },
        "slots": {
          "body": [
            {
              "component": "field",
              "props": {
                "label": "Work email",
                "helper": "Use the email tied to your organization.",
                "for": "login-email",
                "required": "true"
              },
              "slots": {
                "control": [
                  {
                    "component": "input",
                    "props": {
                      "id": "login-email",
                      "type": "email",
                      "name": "email",
                      "autocomplete": "email",
                      "placeholder": "engineer@company.com"
                    }
                  }
                ]
              }
            },
            {
              "component": "field",
              "props": {
                "label": "Password",
                "helper": "Passwords are case sensitive.",
                "for": "login-password",
                "required": "true"
              },
              "slots": {
                "control": [
                  {
                    "component": "input",
                    "props": {
                      "id": "login-password",
                      "type": "password",
                      "name": "password",
                      "autocomplete": "current-password",
                      "placeholder": "Enter your password"
                    }
                  }
                ]
              }
            }
          ],
          "footer": [
            {
              "component": "button",
              "props": {
                "variant": "primary",
                "text": "Continue"
              }
            }
          ]
        }
      }
    ],
    "aside": []
  },
  "activation": {
    "bootstrap": "full-runtime",
    "mode": "page",
    "required": false,
    "source": "ui",
    "runtimeDependencies": [],
    "typeIComponents": [
      "button",
      "card",
      "field",
      "input"
    ],
    "typeIIComponents": []
  },
  "componentsUsed": [
    "button",
    "card",
    "field",
    "input"
  ]
}
